<?xml version="1.0" encoding="UTF-8"?>
<!DOCTYPE bdedt SYSTEM "bdedt.dtd">
<bdedt>
	<inspecteurs>
	    <inspecteur id="1" promotion="4GI">
	      <nom>Remen</nom>
	      <prénom>Alexander</prénom>
	      <mél>alex.remen@gmail.com</mél>
	      <login>aremen</login>
	      <pass>toto1</pass>
	    </inspecteur>
	    <inspecteur id="2" promotion="4RT">
	      <nom>Vo Thanh</nom>
	      <prénom>Tonya</prénom>
	      <mél>sadako22@free.fr</mél>
	      <login>tvo_than</login>
	      <pass>toto2</pass>
	    </inspecteur>
		<inspecteur id="3" promotion="4GM">
			<nom>inspect3</nom>
			<prénom>toto3</prénom>
			<mél>toto3@bla</mél>
			<login>toto3</login>
			<pass>toto3</pass>
		</inspecteur>
	</inspecteurs>
	<enseignants>
		<enseignant id="1">
			<nom>enseign1</nom>
			<prénom>titi1</prénom>
			<mél>titi1@bla</mél>
			<login>titi1</login>
			<pass>titi1</pass>
		</enseignant>
		<enseignant id="2">
			<nom>enseign2</nom>
			<prénom>titi2</prénom>
			<mél>titi2@bla</mél>
			<login>titi2</login>
			<pass>titi2</pass>
		</enseignant>
		<enseignant id="3">
			<nom>enseign3</nom>
			<prénom>titi3</prénom>
			<mél>titi3@bla</mél>
			<login>titi3</login>
			<pass>titi3</pass>
		</enseignant>
	</enseignants>
	<étudiants>
		<promotion id="4GI">
				<étudiant id="1">
					<nom>etud1</nom>
					<prénom>lala1</prénom>
					<login>lala1</login>
					<pass>lala1</pass>
				</étudiant>
				<étudiant id="2">
					<nom>etud2</nom>
					<prénom>lala2</prénom>
					<login>lala2</login>
					<pass>lala2</pass>
				</étudiant>
		</promotion>
		<promotion id="4RT">
				<étudiant id="3">
					<nom>etud3</nom>
					<prénom>lala3</prénom>
					<login>lala3</login>
					<pass>lala3</pass>
				</étudiant>
				<étudiant id="4">
					<nom>etud4</nom>
					<prénom>lala4</prénom>
					<login>lala4</login>
					<pass>lala4</pass>
				</étudiant>
		</promotion>
		<promotion id="4GM">
				<étudiant id="5">
					<nom>etud5</nom>
					<prénom>lala5</prénom>
					<login>lala5</login>
					<pass>lala5</pass>
				</étudiant>
				<étudiant id="6">
					<nom>etud6</nom>
					<prénom>lala6</prénom>
					<login>lala6</login>
					<pass>lala6</pass>
				</étudiant>
		</promotion>
	</étudiants>
	<groupes>
		<groupe id="1" étudiants="1 2"/>
		<groupe id="11" étudiants="1"/>
		<groupe id="12" étudiants="2"/>
		<groupe id="2" étudiants="3 4"/>
		<groupe id="21" étudiants="3"/>
		<groupe id="22" étudiants="4"/>
		<groupe id="3" étudiants="5 6"/>
		<groupe id="31" étudiants="5"/>
		<groupe id="32" étudiants="6"/>
	</groupes>
	<matières>
		<matière id="1" type="obligatoire">
			<intitulé>mat1</intitulé>
			<enseignements>
				<CM enseignants="1 2 " groupes="1 2" volume="5:00"/>
				<TD enseignants="3" groupes="3" volume="10:00"/>
			</enseignements>
		</matière>
		<matière id="2" type="facultatif">
			<intitulé>mat2</intitulé>
			<enseignements>
				<CM enseignants="1 2" groupes="1 2" volume="5:00"/>
				<TD enseignants="3" groupes="3" volume="10:00"/>
			</enseignements>
		</matière>
		<matière id="3" type="obligatoire">
			<intitulé>mat3</intitulé>
			<enseignements>
				<CM enseignants="1 2 " groupes="1 2" volume="5:00"/>
				<TD enseignants="3" groupes="3" volume="10:00"/>
			</enseignements>
		</matière>
	</matières>
	<salles>
		<salle taille="15" id="1" type="amphi"/>
		<salle taille="15" id="2" type="cours"/>
		<salle taille="15" id="3" type="cours"/>
		<salle taille="15" id="4" type="tp"/>
	</salles>
	<edt>
		<réservation date="22/10/2007" salle="1" heure="8:00" durée="1:15" groupe="1" matière="1"/>
		<réservation date="22/11/2007" salle="2" heure="8:00" durée="1:15" groupe="2" matière="2"/>
		<réservation date="22/12/2007" salle="3" heure="8:00" durée="1:15" groupe="3" matière="3"/>
		<réservation date="07/01/2007" salle="3" heure="8:00" durée="1:15" groupe="3" matière="3"/>
	</edt>
</bdedt>
